Name,IntPS__Code__c,IntPS__EOB_Description__c,IntPS__Remark_Code__c,IntPS__Type__c
Add a touch of boho flair with this fringed suede skirt  a stylish and trendy choice.,JKLM1234,Transcription for training materials,HIJK9012,Ineligible Claim Code
Stay warm and stylish in this faux fur trim parka  a cozy and chic outerwear option.,ZABC9012,Transcription for accounting departments,BCDE5678,Ineligible Claim Code
Step out in style with these faux snakeskin booties that add a trendy edge to your look.,BCDE5678,Transcription for accessibility purposes,FGHI1234,IPS
Stay cozy and chic in this cable knit sweater dress  a stylish and comfortable choice for the season.,TUVW7890,Transcription for healthcare providers,DEFG3456,User Claim Hold Code
Accessorize your look with this embellished clutch that adds a touch of glam.,PQRS9012,Transcribed text matching the spoken words,RSTU9012,NSA